{
  "$schema": "https://json-schema.org/draft/2020-12/schema",
  "items": {
    "properties": {
      "artifact_kind": {
        "type": "string"
      },
      "id": {
        "type": "string"
      },
      "label": {
        "type": "string"
      },
      "ref": {
        "type": "string"
      }
    },
    "required": [
      "id",
      "artifact_kind",
      "ref",
      "label"
    ],
    "type": "object"
  },
  "type": "array"
}